"","x"
"1","20OOO에 다시봐도 명작 hd,3d로 재개봉했음 좋겠다 "
"2","확장편도 지루하지않음 "
"3","10년이넘도록볼때마다나를희망차게만드는영화 "
"4","몇 번을 다시봐도 미친거 같다 "
"5","헬름협곡 전투씬은 영화 역사상 최고의 명장면이다...상상속의 세상을 완벽하게 구현해 낸 위대한 영화...평점 따윈 무의미하다 "
"6","전설로 기억될 헬름협곡 전투신, 판타지 영화의 역사를 새로쓰다 "
"7","이런 영화에 1점짜리 다는 놈들은 벤허 이런거에도 1점 달겠지  점수 달 자격도 없는것들  "
"8","김리 진짜 너무귀여움 OO "
"9","불 붙은 엔트  댐 터져서  불꺼질때가 제일 좋았음 "
"10","로히림!!! 투더킹!!! ㅠㅠ "
"11","이제서야 보고 이기분을 지금 느끼다니.... 헬름협곡 전투씬은 안 잊혀질듯! "
"12","주기적으로 계속 재개봉했으면 좋겠다. "
"13","이때까지도 이것보다 스케일 큰 영화 안나옴.. "
"14","역대급 전투씬 ㄷㄷㄷㄱ "
"15","정말 앞으로 20년이든 30년이든 내가 죽을때까지 이 영화를 뛰어넘는 판타지영화가 과연 또 나올수 있을까? 란 의문이 드는 영화엿다.. 피터잭슨에게 감사했고 반지의제왕 캐스팅및 연기도 정말 지렸다.. 이런 영화를 접..."
"16","마이웨이 내인생 이 영화는 혼자 영화관가서 뙇 편하게 봐줘야한다. 수없이 보다보니 화장실가도될 시간대를 알고있어서 편하다 "
"17","이번에도 개봉당시 극장에서 봤던 그 감동과 전율을 다시 느끼고자, 영등포 스타리움 에서 봤습니다. 극장에서 못봤던 청소년분들 세대는 재개봉 필히 보시길.. 판타지 영화의 레전드예요. 그리고 극장에서  보실분들은 가급..."
"18","오늘 두개의 탑 재개봉 관람 한마디로 정말 짱이다 재개봉 너무 감사합니다 "
"19","10점 만점에 10점밖에 줄 수 없다는 것이 이 영화에 가장 미안한 부분이다. "
"20","피터잭슨이 얼마나 톨킨을 좋아했으면 한장면장면마다 대충만든 장면이없었다 감독 자신도 애착이많았던 영화인게 확실하다 "
"21","판타지의 정석이다....15년전에 봤지만 아직도 그때의 감동이 생생하네 "
"22","언제봐도 백색의 마법사가 된 간달프와, 헬름협곡의 전투장면, 아이센가드에서의 엔트들의 복수등은 전율이 오는 최고의 명장면이 아닐까 싶다. 이런 판타지 영화를 볼 수 있음에 새삼스레 감사하게된다. 너무나 긴 상영시간도..."
"23","Cg가 이렇게 발전했는데도 반지의제왕에 못미치는 영화들이 너무 많아... "
"24","반지의제왕같은 영화 또 안나올까요.. "
"25","간달프가 기병대 끌고올때 소리지름(자연을 보호합시다. 안그러면 엿됩니다) "
"26","이걸 처음봤을때로 다시 돌아가고싶다 "
"27","이런 영화가 다시 나올 수 있을까? "
"28","이런 영화를 만들어줘서 고맙습니다. "
"29","아니 ㅅㅂ cg기술도 이때보다 몇배나 뛰어나고, 연출능력도 기술도 다 발전했는데 왜 반지의제왕을 뛰어넘을만한 영화가 씨알도 안보일까 "
"30","5일째 되는 날 아침에 동쪽을 바라보면 전율이 시작됨. "
"31","헬릅협곡 전투씬은 10년이 지난 지금이 봐도 명장면이다. "
"32","인생최대작. 왜 해리포터랑 비교하는지 이해불가. 압도적 영화 "
"33","마블영화 광팬이지만 반지의제왕에 비하면 애들장난같네 해리포터 트와일라잇 시리즈도 못비빈다 "
"34","시간이 지나도 생각나는 판타지 영화가 있다면 당연 반지의 제왕 시리즈. "
"35","와 진짜 수만 우르크하이 군대 앞의 사루만의 연설, 핼름 협곡 전투며 뭐하나 전율이 안 느껴지는 장면이 없다 "
"36","정말 너무나도 감사합니다 이영화 시리즈 극장에서 보지못한걸 정말 후회했는데 이제보게되었습니다ㅜㅜ 정말 온몸이 떨릴정도로 전율이 흐릅니다 이런영화 이제다시는 없겠죠 "
"37","cgv 판교 진짜 너무한거 아니냐? 상영관도 제일 작은데면서 하루에 한번 상영하는데 시간대가 다 심야야.. 11,12시에 상영함..ㅅㅂ "
"38","2002년 작인데도 불구하고 요즘 나오는 영화들보다 훨씬 전달력이 강하고  CG처리도 실제 느낌이 느껴짐. 시리즈물의 연결성이 반지의 제왕 만한 영화는 매우 드물다. "
"39","액션신, 세계관 때문에 묻혀서 그렇지 보면 볼수록 반지를 두고 나타나는 우정과 탐욕... 프로도가 주인공인 이유는 운반자 역할때문이 아니라 모르도르로 가는 여정속에서 이 친구가 겪는 변화가 우리랑 똑같아서 일지가 아..."
"40","시리즈중 이게 제일 명작이지. 영화사에 길이남을 대서사판타지이기에 만점줌. "
"41","반지삼부작은 마스터피스다.. 스토리텔링완벽,cg도 수준급(지금봐도 저어어언혀 촌스럽지가 않음),영상미,캐릭터들의 뚜렷한 개성과 역할,떡밥던지고 회수도 완벽,bgm들도 훌륭.. 완벽이라는 말밖에 안떠오름.. "
"42","가장 완벽한 영화 "
"43","엄청나게 재미있습니다. "
"44","시리즈중 제일 좋아하는! 3시간 40분이라는 러닝타임이 훅 지나갔다. 10번도 볼수 있을것 같음. 스토리텔링, 연출, 미장센, 디테일, 음악까지 모든게 완벽한 총체적 예술작품. 피터잭슨은 천재인듯! "
"45","와..이걸 보니까 어벤져스 엔드게임은 아무것도 아니였다는게 느껴진다... 미쳣다 미쳣어 "
"46","10년후 또 극장에서 볼수 있었으면 좋겠다. 재개봉덕분에 3주간 너무나 행복했다.. "
"47","한번봐서는 안될영화 "
"48","티비에서대충해주는거 중간부터봐서제대로이해가안됫다 그냥cg쩌는 영화인줄알앗는대 아니다 진짜 대작이다 그리고이게OO전꺼라니 지금 개봉해도 손색이없을 정도다 배경 배우 노래 모두완벽하고스토리도 탄탄하다 어렷을때봐서잘몰랏는..."
"49","모든게 완벽 그자체군... "
"50","판타지영화의 바이블같은 존재 말이필요없다 "
"51"," 평점 10점안주는 것들은 뭐냐 대체감히 이런 명작을 평가한다니 "
"52","위대하고, 경이로우며, 장엄하다 "
"53","탄탄하고 완벽한 시나리오대로 따라가는 배우들과 감동을 배가 시키는 전쟁씬은 매우 훌륭하다. "
"54","개인적으로 1편이 너무 퍼펙트해서 후속은 조금 루즈해질줄 알았는데 갓지의 제왕은 그런거없이 더욱 진화해서 돌아왔다 "
"55","마지막 샘이 프로도에게 정신차리고 해준 말들이 정말 가슴에 와닿는다... 뚱뚱하고 외모상으론 없어보이지만 정말 진국이다 샘...  2002년 영화관에서 봤을때 정말 전율이 돟앗엇는데 언제보든 정말 위화감없는 영화. ..."
"56","이정도면 진짜 문화유산으로 등극해야됨;; "
"57","판타지계의 최고명작! "
"58","이 영화는 절대 못 뛰어넘는다. 헬름협곡 마지막 전투에서 기마부대가 내려오는 장면은 진짜 전율이 흐르면서 말할 수 없는 무언가가 느껴진다. "
"59","내 살아생전에 이런 영화가 또 나올까요..?피터잭슨 감독님 감사합니다~ "
"60","으어 쩐다 진짜 대박이다 "
"61","판타지계의 걸작.하나 놓진게 없다 "
"62","이런 명작 판타지 영화 언제쯤 다시 나올까요 "
"63","시리즈 중 최고의 작품일듯. 전투신의 강렬한 인상은 그 어떤 영화중에 최고라고 말할 수 있다. 극장에서 본게 자랑인 영화중 하나. "
"64","와.. 이거 정말 최고네.ㄷㄷㄷㄷ "
"65","울었다.. 아놔 글자수 10자 "
"66","감독판으로 1,2,3 편 다봤습니다. 15시간 걸렸네요  최고입니다 "
"67","얼마나 대작이었냐면 영화 내려가고나서 1년 인가 2년 지나서 해운대 메가박스에서 1.2.3 재개봉했는데 관중 꽉찼었음 "
"68","호빗시리즈 3편을 다보고 나서야 반지의 제왕 시리즈3부작이 얼마나 뛰어난 영화인지 다시한번 느끼게 되었다 "
"69","세편중에 전쟁씬이 가장 멋있었던 "
"70","재미 없다는 사람은 이해 못했거나 그냥 재밌다고 인정하기 싫은거임 "
"71","마지막이 무척 인상깊게남은 거같음. 헬름협곡 전투와 엔트들이 아이센가드로 진격할때가 가장 가슴을 울림. "
"72","반지의 제왕 그 이미지를 만들어놓은 두개의탑21세기 최고의 판타지영화 "
"73","호빗은 절대 반지의 제왕을 뛰어넘을 수 없다 "
"74","판타지영화는 이렇게 만드는거라고 피터잭슨이 반지의제왕을 통해 알려줬지만 10년이 지난 지금도 다른감독들은 알아먹지를 못하는거 같다 "
"75","어떤 판타지가 이토록 드워프와 엘프를 잘 묘사하였단 말인가? 아 난 그 종족들의 특성에 매료되어 버렸다. 그리고 5명 밖에 없는 선의의 마법사 간달프에게  난 혼이 뺏긴 듯하다. "
"76","복잡한 세계관을 간결하게 각본으로 재구성하고, 압도적인 영상으로 표현하는 피터 잭슨. 영화화란 진짜 이런 것이다 "
"77","영화 후반부에 샘이 한 말이 진짜 멋있었다.. "
"78","이만한 영화는 없는듯 세계최고인듯 "
"79","엘프지원군에서 눈물남 "
"80","반지의제왕에 재미가 극도로 달아오르기 시작한게 이영화의 중반부부터임..반지의제왕에 하이라이트는.. 2편의 중반부부터 3편 끝날때까지다.. "
"81","헬름협곡은 단지 시작에 불과했다. "
"82","배우들진짜캐스팅 잘한듯..반지의제왕하고 호빗본 이후로는 다른 판타지영화 진짜눈에 안들어옴ㅜ "
"83","아라곤 정말 쩌는듯 액션과 스케일 모두 대박 마지막 전투는 정말 대광경임 정말하하나부터 열꺼자 완벽한영화 "
"84","일년에 최소 1번씩 본다. 이영화에 본질을 알면 헤어나올수가 없다.최고 "
"85","워... 명작... "
"86","난 정말 반지의제왕 보면서 눈물을 흘렸다 간달프하고 에오메르가 군대이끌고와서 언덕에서 내려올때 전율이 돋으면서 눈물흘림 "
"87","아라곤 진짜 좋다 "
"88","솔직히 아바타는 이영화에 비해선 거품이다 "
"89","모든 판타지작품이 나올때마다 '반지의 제왕을 뛰어넘는' 이란 타이틀이 붙곤하는데 개인적으로 불가능한 일이라고 생각한다. "
"90","최고다 최고! 진짜 대작이면서 명작인 영화. 헬름협곡 전투씬 하나하나 입이 떡 벌어졌다. 왜 난 이영화를 영화관의 큰 화면으로 보지않았나. "
"91","그냥 미쳤습니다. 2번보러갑니다 "
"92","연출이 미쳤구요 스토리가 너무 감동적입니다 후반부에는 보는 내내 울었네요  "
"93","영화광인데 평점 남긴 거 처음....진짜 레전드 "
"94","한 번 본 영화 또 안보는데 너무 재밌어서 또 보러갈거임 "
"95","와 미쳣다 다음편이 극장판으로 나올지는 모르겠지만 꼭 보십쇼 여러분 전 오늘 4dx 로 또 보러갑니다. "
"96","옆에서 자꾸 훌쩍이는 소리가 들리더라구요,,, 재밌었습니다 "
"97","꼭 봐야 합니다 가슴이 웅장해집니다.... "
"98","말이  필요없음 울뻔한거 참고 겨우봤다 "
"99","귀멸의 칼날 팬이라면 처음부터 끝까지 소름끼치면서 볼 재미있고 멋있는 영화 "
"100","렌고쿠! 렌고쿠! 렌고쿠! 렌고쿠! 렌고쿠! 렌고쿠! 렌고쿠! 렌고쿠! 렌고쿠! 렌고쿠! 렌고쿠! 렌고쿠! 렌고쿠! 렌고쿠! 렌고쿠! 렌고쿠! 렌고쿠! 렌고쿠! 렌고쿠! 렌고쿠! 렌고쿠! 렌고쿠! 렌고쿠! 렌고쿠! ..."
"101","렌고쿠를 왜 죽였습니까아아아아악!!!!ㅠ 크레딧에 나오는 오에스티가 너무 슬퍼요 "
"102","아카자 처음 등장할때 브금이랑 위압감 진짜 오져서 소름돋았.. 만화책으로 볼때는 이정도는 아니였는데작화가 대박이라 몰입감 쩔게봤어요 "
"103","술먹다가 도저히 궁금해서 못참아서 뛰어감끝나고 여자화장실에 코푸는소리내가 오타큐라니내가 오타쿠라니...!!! ㅠㅠ "
"104","너무 좋아 진짜 귀칼!!!! "
"105","알고 있는 내용이지만 마지막에 눈물나네요 "
"106","마지막액션신에 다들 숨참고보는게 느껴졌다 "
"107","TV판보다 더 화려한 액션들을 볼 수 있음 "
"108","보는데 3번울었네요 감동의 쓰나미에요 ㅜ 한번더봄 "
"109","오타쿠도 아닙니다. 일본을 마냥 좋아하는 사람도 아닙니다. 흥행에 이유가 있는지 없는지 눈으로 판단하기위해 직접 가서 봤습니다. 진짜였습니다. 간만에 영화관에서 봐야하는 영화였고, 오히려 정치색에 퇴색된 명작이었습니..."
"110","끝나고 렌고쿠 밖에 생각 안남 극장에서 보길 잘했다 ㅠ "
"111","수능 끝난 아들과 함께 나이 오십에 애니 보고 눈물이 났습니다.남자의 신념을 느낄 수 있는 영화입니다 "
"112","진짜 말도안되게 눈호강 귀호함 "
"113","레전드 갬성 지립니다 꼭 보세요 "
"114","탄지로의 꿈에서 핑 돌았던 눈물이, 렌코쿠 전투씬에서 쏟아져내림ㅜㅜ  또보고싶다.... "
"115","이제서야 귀멸을 알게되서 1기 24시간도 안되서정주행다하고 뛰어가서 극장판보고옴 ㅠㅠㅠㅠ사랑해요 귀멸 "
"116","렌고쿠 그는 빛빛빛... "
"117","도랏음..두번봤음 걍 미침 "
"118","그냥 미쳤다... 만화로 봤을 땐 그냥 하... 개빡친다 라는 느낌이었는데 극장판 보고나니까 그냥 오열함 ㄹㅇ로 거리두기때문에 양 옆에 아무도 없어서 다행이었음. 스토리 다 알고 있는 상태에서 봤는데도 눈물 핑 남...."
"119","미쳤습니다 영화관이 눈물이 넘쳐 한강이 되는 것을 느꼈습니다. 이정도면 쓰나미 각입니다 "
"120","솔직히 소울보다 귀칼이 더 재밌었음 ㅎㅎ 나는 "
"121","진정한 주인공은 렌고쿠입니다. 모두 찬양하세요 "
"122","상남자 렌고쿠 반했습니다 꼭 보세요 "
"123","지짜 귀칼애니 1기안보고온 사람들이 별점테러 안했으면 무조건 10점아니 100점입니다...자식 낳으면 무조건 보여주고싶은 애니.... 제 인생 좌우명도 앞으로 마음을 불태워라로 바꿉니다.... "
"124","인간이 강한 이유, 인간이 아름다운 이유. "
"125","더 이상 말 할 가치가 없습니다. 그냥 보세요. "
"126","보는내내 눈을 뗄 수가 없었고 감동도 오집니당 엔딩 크레딧 다 내려 갈 때 까지 관객들  거의 안나갔어요 대박임 "
"127","애니메이션을 안봤어도 재밌게 볼수 있습니다 "
"128","정말 재미있었어요. 다시 보러 갈 생각입니다. "
"129","처음은 이상한 녀석이였는데, 그는 빛주였습니다... "
"130","꽤나 긴 분량을 하나에 담은 극장판이라 중간에 좀 루즈하긴한데 가장 중요한 염주랑 탄지로의 과거 그리고 감성벨 부분을 굉장히 잘 살렸음. 유포터블 작화는 소년만화 역대 최고인듯... 리사는 귀칼 애니 엔딩까지 오스트..."
"131","제대로된만남은 오늘이 처음인 잘모르는 후배가 자기선배가 이겼다고 이유를 나열하며 목이 찢어져라 분노하며 적에게 외치는데 선임자로서 후배한테 받을수있는 가장최고의 찬사아닐까? 그장면을 연출한 작가와 성우 연기, 연출,..."
"132","아이들때문에 보기 시작해서 오늘 영화까지 보고왔어요 개봉일만 손꼽아기다리다 드디어 보고 왔는데 강추입니다^^ 너무너무 재밌어요ㅎ "
"133","너무 재미있었어요 아직 못보신 분들 강추합니다 "
"134","넘 잼씀 렌고쿠 죽을때 울었다... "
"135","하나부터 열까지 아무것도 빠질수 없는 만화역대급을 넘어섬 "
"136","눈물 쟐쟐쟐 ㅠㅠㅠㅠ 네즈코 귀여워 미쳐요 "
"137","스토리도 스토리인데 작화가 멱살 잡고 캐리했다 액션씬 나올때마다 가슴 웅장해져서 기립박수 치고싶은거 참았다 솔직히 내가 기립박수 쳤으면 극장 관객 모두가 다 일어났을거다 염주 간지 실화냐? 진짜 눈물이 다 나왔다 참..."
"138","원작에서 나오지 않은 사소한 장면, 대사가 좋았고 액션씬이 정말...  작화진 몇명 쓰러졌겟네요 "
"139","왜 렌고쿠 렌고쿠 하는지 알겠음. 훌쩍. 최고에요~! "
"140","너무 감동적이고 재밌었습니다!!! "
"141","울진 않았다.. 눈물만 흘럿어 "
"142","자신이 죽어가고 있다는 것을 알면서도 약한자들을 지키겠다는 어머니와의 약속을 위해 한계를 거듭 극복하는 모습이 너무 감동적이었습니다. "
"143","강하다는건 무엇일까 생각하게된 "
"144","렌고쿠를 원픽으로 만들어준 영화입니다!! "
"145","너무 재미있게 봤습다 유포터블은 그냥 믿고 보면 될것 같아요 "
"146","너무재밌게봤습니다 소년만화는 이래야지.. "
"147","기다리던 무한열차 볼수 있어서 참 즐거웟습니다. "
"148","애니메이션 잘 안보는데 진짜 괜찮음. 후회 안함 "
"149","나이 성별 국적 모든걸 신경쓰지마시고꼭 보시길 힘든 코로나시대지만 방역지침 잘지키면서꼭 극장에서. "
"150","진짜 농담안칩니다 이거 꼭보시요 제발 함만 "
"151","역시 소년물의 정석. 액션씬은 빼놓을 것도 없이 훌륭했다. "
"152","애니를 처음 극장에서 봤는데 앞으로 자주 갈듯합니다만화책으로 볼때 상상한 목소리랑 달라서 신기하고 각 캐릭터별 연기에 생생한 감동을 받았습니다 "
"153","정말 연출 최고에요 저 정말 많이 울었어요 렌고쿠 넘 멋있고ㅜㅜ귀멸의 칼날 모르시는 분이 보셔도 충분히 재밌게 볼 수 있어요ㅜㅜ???? "
"154","물과 불의 향연..가슴 찡하다 "
"155","애니를 평소에 안보던 사람인데, 유일하게 원작완결까지 찾아보게한 만화.. 애니를 영화관에서 보니 좀 신기하기도 했는데, 전율도 배로 느껴지더라구요..  만화로 볼 때도 감동적이었는데, 애니화된걸보니 작화가 어마무..."
"156","너무 재미있어서 태어나서 처음으로 별점줍니다. "
"157","이것은 원피스를 뛰어넘은 인생 띵작이다... "
"158","말 그대로 영혼을 갈아 넣어버렸습니다..애니메이션을  이만큼 정밀하게 그릴 수 있다는 것에 놀라웠어요! 다시 보러 가고 싶어집니다. "
"159","만화책으로 표현된 연출의 한계를 애니가 뛰어넘었네요! "
"160","렌고쿠의 렌고쿠 그냥 미쳤다고밖에 말할 수 없다. "
"161","갓귀칼...작화진이 얼마나 갈렸는지 짐작도 안되네 "
"162","말이 필요읎다 솔직히 열차에서 싸운것보다 아카자vs렌고쿠 전투씬 이것밖에 기억에 안남음 영화의 진정한 하이라이트라 봅니다 마지막 장면도 너무 슬펐네요ㅠㅠ "
"163","렌코쿠 형님 때문에 울었습니다 "
"164","나이 서른에 애니보고 지려버렸습니다... "
"165","내 나이 29살.. 내 꿈은 주가 되는 것이다 "
"166","렌고쿠가 죽기 직전, 어머니랑 이야기하는 장면에서 참았던 눈물이 나왔다.이거는 애니메이션이 아니고 작품으로 봐야할것같다.왜 일본열도가 센과치히로를 제치고 귀멸의칼날에 열광을 하는지 알거같다 "
"167","좋은스토리, 극장판다운 연출, 앞부분이 별로인 사람들도 입을 다물게하는 마지막부분. 살면서 애니영화보고 관객들 우는거처음본 명작 영화!! "
"168","저야말로 당신같은 분께서 낳아주셔서 영광이었습니다. "
"169","강한 자는 약한 자를 지켜줘야 한다. 이 짧은 한마디를 117분 동안 지켜나가는 모습에서 눈물이 났다.  진짜 재미있다. "
"170","일본이 젤 잘하는걸 존나 잘했다 "
"171","우리들이 바라는 참된어른 "
"172","일본에서 역대 흥행 1위한 영화라던데 재밌음 ? 재밌으면 좋아요좀 "
"173","그냥 아무 말도 하지 말고 보세요ㅠ 연출 너무 좋고 안 좋았던 게 없었음ㅜㅜ "
"174","작화, 영상미, 스토리 모두 최고였어요 전투씬은 진짜 역대급이였습니다. "
"175","단 두마디  절대 후회안함 "
"176","영상미가 너무 좋앗다. 액션 신이 예상보다 많이 화려해서 보는재미가 잇엇다. "
"177","40대아재 눈물콧물 질질짜고왔습니다.. ㅠㅠ "
"178","작붕이라곤 찾아볼 수도 없고 스토리와 브금 모든게 완벽했던 영화 안보면 후회합니다 "
"179","영화보고 운적이 거의없는데 렌고쿠.. 사랑합니다ㅠㅠ "
"180","와 이거 안보면 인생 절반 후회한겁니다 여러분 "
"181","가난한 반지하의 냄새는 지울 수 없고 그 냄새를 혐오하는 부자들의 태도는 감출 수 없다 "
"182","처음엔 웃으면서 보다가 뒤로 갈 수록 웃을 수 없었던 "
"183","지금 우리들의 자화상을 블랙코미디로 승화시킨 슬픈 걸작이다.우리가 어떻게 사는게 잘 사는 것일까?돈이 많은 사람들과 가진거 하나 없는 가난한 사람들에게 바치는 봉준호표 이솝우화. "
"184","ㅠㅠ 촤고 말이필요없는영화 "
"185","의사같지않은 의사 경찰같지않은 경찰눌러붙은 기생충들 "
"186","정말 가난이 사람을 기생충으로 만들었나 부유해도 벌레같은 사람들이 있고 가난해도 행복을 쫓는 사람들이 있다 환경이 사람에게 영향을 주는 것은 맞지만 모든 사람이 가난을 겪는다고 벌레처럼 살진 않는다 극빈층을 마치 벌..."
"187","영화가 끝나고 집으로 돌아왔다. 지하철을 타고. "
"188","서로의 선을 넘지 않으려던 두 남자. 그러나 그 선을 누가 먼저 넘기려 했는지는 아무도 계획하지 않았을 것이다. "
"189","그놈의 대왕 카스테라! "
"190","헐리웃 체계로 가는 한국영화 산업의 좋은 본보기 "
"191","설국열차에서 하층민이 선을 넘을수 있다는 희망을 보여줬다면, 기생충에서는 하층민이 선을 넘은 댓가를 보여준다 "
"192","충격과 공포 절대 스포당하지 마세요. "
"193","당신도 사람을 냄새로 판단했던 적이 있을것이다. "
"194","뒷맛이 너무 씁쓸하다. 집에 오는 내내, 집에 와서도 계속 마음이 무겁다. 하지만 괜찮아져야지. 맘 껏 씁쓸해할 시간도 없으니. 돈 벌어야하니까. 그렇게 100년을 숨만 쉬고 모아도 그런집은 월세로도 못살겠지. 허허..."
"195","금방 보고 나왔는데...봉준호감독 영화인데 왜 박찬욱감독 영화를 본 느낌이지.어쨌든 최고다. 봉드로 역시 천재!!이정은님 연기상 줘야한다 진짜 "
"196","내가 다 비참해지는 영화 "
"197","부자들이 가난 팔아 받은 상 "
"198","충격받았음.. 내용이 너무 신선했고 .. 절대 웃긴 씬이 아닌데 웃는 몇몇 관객한테도 충격받았음.. "
"199","우와.. 영화 보고 오만가지 생각이 다 들거라고 하시더니.. 진짜 오만가지 생각이 다 든다 "
"200","이정은 배우의 기괴한 연기가  꽤 여운이 길구려. "
"201","오랜만에 혼자가서 본 영화 부자와 거지를 이중적으로 그려놓았지만 결국 모두가 이기적이고 절대 선은 없다는것을 느꼈습니다. 근데 얘들 데리고 보는건 비추천합니다. 보는 내내 이게 왜 15세관람영화인지 모르겠네요 19세..."
"202","말이 필요없는 영화 모두 꼭 한번쯤은 봐야할법한 영화입니다. 그리고 조여정이 개인적으로 크게 한껀 한것같습니다 "
"203","영화보는내내 집중할수밖에없네요~최고!.칸 대상감 맞습니다! "
"204","나는 이 영화에 몇 번이고 내 자신을 투영한 내가 미웠다. 그의 상상력에 감탄만 나온다. "
"205","가난의 냄새가 너무 서글프다. "
"206","부모님이랑 보러 가지 마세요. "
"207","묘한 기분이다... 어느삶도 행복해보이지 않는다 "
"208","결국은 우리 모두가 기생충 계획은 한번도 성공한적이 없고 될데로 되라 우발적 감정적으로 대처.결말은 항상 좋지 않고 그 책임은 대를 이어 넘겨지지... "
"209","똥물이 넘치는 변기에 앉아서 담배를 태우는 박소담. 영원히 잊지 못할 장면. 최고다. "
"210","시간 가는 줄 모르고 보았으나 영화가 끝나자마자 느껴지는 씁쓸함 "
"211","인터폰에 이정은이 등장한 순간부터 장르가 바뀐다 "
"212","특별히 미워하고 증오할만한 '악인'이 한명도 없기에 더욱 답답하고 우울했던 영화, 세상의 불평등 자체가 인간의 본성에 의한 숙명이라고 말하는것 같았기에... "
"213","부자들도 기쁨과 슬픔과 사랑과 두려움을 느낀다. 부자들은 의외로 순진무구하고 그들의 폭력에는 악의가 없다. 빈부격차의 폭력성은 이토록 잔혹하다. "
"214","잘 만든 영화인건 맞고 큰상도 받아서 의미도 있지만.. 나처럼 이 영화가 안맞는 분들이 있을듯... 마음이 불편해지는 영화 "
